{
  "schema_version": "1.0",
  "density": "medium",
  "protagonist_role": "岑照用最严肃的监考和镜阵术语处理考生对幻境规则的荒谬解释，但每次回应都必须改变考试顺序、证据、资源或责任",
  "character_contrasts": [
    "岑照把幻境提示视为安全边界，唐桥把所有提示都理解成押题暗号",
    "薛简先信封签与调用记录，岑照更重视残痕方向和镜面角度",
    "安苇只问风险与责任，考生只问绕开陷阱算不算聪明",
    "阮青总说副镜只是暂放，反光会把暂放放大成整排考生的路线草图"
  ],
  "allowed_mechanisms": ["考生把警示当押题", "监考规章与幻象现场错位", "角色对作弊定义的立场反差", "用严肃术语处理荒谬申诉", "一个省事动作引发连锁考场后果", "前文座次、封签或反光回调产生新证据"],
  "forbidden_humor": ["神识伤势、考场失控或资格冻结被笑话取消", "全员突然降智", "围观震惊和反复打脸", "网络热梗", "旁白直接解释笑点", "靠考生无休止争吵拖延核查"],
  "language_boundaries": ["岑照使用短句、镜面角度、残痕和节点术语", "薛简先引用正式记录再判断，证据成立后明确更正", "安苇少评价动机，只追问风险、资源和程序", "唐桥擅长给偶然反光编押题理论，但必须接受后续随机幻境推翻", "阮青回避赶工动机，但不能否认可核验的副镜位置和封签时间"],
  "callbacks": [
    {"callback_id": "warning-is-not-a-hint", "setup": "考生把不得触碰的警示牌抄进押题笔记", "rule": "后续回调必须改变分组、座次或安全检查，不能只重复台词"},
    {"callback_id": "lucky-route-sketch", "setup": "唐桥把副镜反光画成运气图", "rule": "每次回调必须增加新的镜面角度、残痕或责任信息"},
    {"callback_id": "temporarily-unsealed", "setup": "阮青把未封副镜称为只是暂时没封", "rule": "回调时必须产生新的考场、资源或程序后果"}
  ],
  "fatigued_mechanisms": [],
  "serious_scene_limits": ["试场错层、全场重置、左眼镜灼加重、突破和资格裁定场景降低笑点密度"]
}
