{
  "schema_version": "1.0",
  "density": "medium",
  "protagonist_role": "陆宁用严肃兽息术解释荒谬动物行为，但每次解释都必须导向一次实际行动或责任",
  "character_contrasts": [
    "陆宁按呼吸节奏判断，乔穗按灵兽表情判断",
    "许苛只认铃序、份量和损坏，白绒只认谁手里没有燥阳谷味",
    "贺鸣擅长把诱引说成顺手，贪食豚会把他的顺手变成持续压石",
    "乔穗把清栏叫重新询问证人，最终仍要亲自清理"
  ],
  "allowed_mechanisms": ["动物习性反转人类判断", "严肃翻译荒谬兽息", "铃序与动作错位", "角色立场反差", "前文动物行为回调", "行动造成连锁误会"],
  "forbidden_humor": ["伤势、冲栏或器损被笑话取消", "灵兽开口破案", "网络热梗", "全员降智", "围观震惊", "反复靠动物抢东西拖延剧情"],
  "language_boundaries": ["陆宁短句描述节奏和动作", "乔穗认真使用拟人说法但接受证据纠正", "许苛用份量和铃次说话", "贺鸣回避动机但不能否认具体去向"],
  "callbacks": [
    {"callback_id": "pig-on-stone", "setup": "贪食豚把压力石当暖垫", "rule": "每次回调必须增加新的阵路后果或责任信息"},
    {"callback_id": "deer-testimony", "setup": "乔穗把白绒的选择称为证词", "rule": "回调时必须转换为可验证的气味、踏痕或进食行为"},
    {"callback_id": "bell-count", "setup": "许苛要求所有人按铃次复述行动", "rule": "同一计数规则后续也必须约束许苛的裁定"}
  ],
  "fatigued_mechanisms": [],
  "serious_scene_limits": ["伤势加重、鹿群冲栏、栏门损坏、扣点和资格裁定场景降低笑点密度"]
}
