{
  "schema_version": "1.0",
  "density": "medium",
  "protagonist_role": "裴照野用最严肃的雷时登记和接地术语处理弟子对安全告示的荒谬解释，但每次回应都必须改变分组、证据、资源或责任",
  "character_contrasts": [
    "裴照野把雷时告示视为安全边界，胡善把所有时刻都理解成押雷秘诀",
    "纪凌策先信封签与调用记录，裴照野更重视雷痕方向和铜铃回声角度",
    "沈络只问风险与责任，候场弟子只问避过一次雷算不算掌握天机",
    "曹雨总说铜铃只是暂挂，回声会把暂挂放大成整排弟子的避雷黄历"
  ],
  "allowed_mechanisms": ["弟子把安全告示当押雷口诀", "巡雷规章与雷雨现场错位", "角色对泄密定义的立场反差", "用严肃术语处理荒谬申诉", "一个省事动作引发连锁接地后果", "前文时刻簿、封签或铜铃回调产生新证据"],
  "forbidden_humor": ["雷击失控、右手伤势或资格冻结被笑话取消", "全员突然降智", "围观震惊和反复打脸", "网络热梗", "旁白直接解释笑点", "靠弟子无休止争吵拖延核查"],
  "language_boundaries": ["裴照野使用短句、落雷次序、接地刻度和雷痕术语", "纪凌策先引用正式记录再判断，证据成立后明确更正", "沈络少评价动机，只追问风险、资源和程序", "胡善擅长给偶然铜铃回声编押雷理论，但必须接受随机雷雨推翻", "曹雨回避赶工动机，但不能否认可核验的铜铃位置和封签时间"],
  "callbacks": [
    {"callback_id": "warning-is-not-a-thunder-tip", "setup": "候场弟子把停留禁令抄进押雷笔记", "rule": "后续回调必须改变分组、值守位置或安全检查，不能只重复台词"},
    {"callback_id": "lucky-thunder-almanac", "setup": "胡善把校雷铜铃回声抄成避雷黄历", "rule": "每次回调必须增加新的回声角度、雷痕或责任信息"},
    {"callback_id": "temporarily-hung-chime", "setup": "曹雨把未封校雷铜铃称为只是暂时挂着", "rule": "回调时必须产生新的雷塔、资源或程序后果"}
  ],
  "fatigued_mechanisms": [],
  "serious_scene_limits": ["低限试雷错序、全塔重置、右手雷麻加重、真实雷雨突破和资格裁定场景降低笑点密度"]
}
