{
  "schema_version": "1.0",
  "density": "medium",
  "protagonist_role": "陆迟用认真账目和字面任务拆解失控药园，越认真越容易把别人的借口变成正式工作项",
  "character_contrasts": [
    "陆迟把人情和错误都记成待办，乔枝把帮助说成降低共同损失",
    "魏远依赖完整表格压人，表格记录完整时也会反向限制他的临时裁量",
    "林素面对荒谬药园仍只问药性、用量、时辰和责任",
    "韩笑善于圆场，但告状藤的字面复述会迫使他解释具体语句的来源"
  ],
  "allowed_mechanisms": [
    "账目字面执行改变劳动分配",
    "乔枝风险告知式对话推动她实际留下帮忙",
    "告状藤复述造成可核查但不充分的线索",
    "规章回调反向要求管事补记录",
    "药性反应让角色的场面控制计划失效",
    "前文用量、工时或命令在后文形成因果回调"
  ],
  "forbidden_humor": [
    "伤势和药材损失被一句玩笑取消",
    "全员突然降智",
    "密集网络热梗",
    "围观群众只会震惊",
    "告状藤直接充当万能真相机器",
    "拿伤残、贫穷或现实群体做羞辱笑料"
  ],
  "language_boundaries": [
    "陆迟短句、精确、像记工单",
    "乔枝句子带条件、风险和退出方案",
    "魏远爱引用验收项和损耗栏",
    "林素短句定边界，不讲长篇道理",
    "韩笑语气圆滑，倾向把具体责任改说成共同误差"
  ],
  "callbacks": [
    {"callback_id": "work-order", "setup": "陆迟把借口写成待办项", "rule": "回调时必须让说借口的人真的承担一项工作"},
    {"callback_id": "shared-loss", "setup": "乔枝把帮忙称为降低共同损失", "rule": "回调时她必须付出时间、资源或证词代价"},
    {"callback_id": "vine-report", "setup": "告状藤只复述完整命令", "rule": "最多连续使用两章，之后必须切换机制"},
    {"callback_id": "form-backfire", "setup": "魏远用表格冻结资格", "rule": "后续同一表格必须要求他承认一项已记录事实"}
  ],
  "fatigued_mechanisms": [],
  "serious_scene_limits": [
    "陆迟伤势加重、药材裂根、贡献点扣减和资格裁定场景降低笑点密度",
    "突破过程不插入连续段子",
    "角色可用反差说话，但后果必须完整落地"
  ]
}
