{
  "schema_version": "1.0",
  "density": "medium",
  "protagonist_role": "冷面实用主义者：越紧张越像在清算账目，但本人不是刻意讲笑话",
  "character_contrasts": [
    {"character_id": "xu-guan", "contrast": "处境狼狈却坚持精确计算风险和债务"},
    {"character_id": "pang-dahai", "contrast": "语言极勇，身体诚实地先找退路，关键时刻仍会回来"},
    {"character_id": "ning-shuang", "contrast": "表情冷淡、措辞极短，却会认真追问被规章忽略的细节"},
    {"character_id": "yan-jiuchi", "contrast": "越失控越依赖条目编号和表格证明一切正常"}
  ],
  "allowed_mechanisms": [
    "规章被过度字面执行后产生的行动后果",
    "角色对同一风险的不同计算方式",
    "严肃口吻处理小范围荒谬事故",
    "吹嘘与实际行动形成反差",
    "前文具体物件或话术在新情境中的回调",
    "信息差推动调查或关系变化"
  ],
  "forbidden_humor": [
    "全员降智",
    "网络热梗和现代平台用语",
    "反复围观震惊",
    "拿伤残、贫困或弱者当笑料",
    "靠旁白解释笑点",
    "让玩笑自动取消赔偿、伤势或逐出风险",
    "把宁霜写成面瘫式万能救场者",
    "让严九尺或罗七无缘无故自曝全部秘密"
  ],
  "language_boundaries": [
    "角色用词符合修仙宗门与底层杂役生活",
    "不使用直播、打卡、KPI、系统弹窗等现代互联网词汇",
    "庞大海句子较长且爱自我辩护，宁霜句子短，严九尺爱引用条目，许观偏数字和后果"
  ],
  "callbacks": [
    {"id": "debt-wording", "setup": "许观把人情和风险说成账目", "rule": "回调必须改变关系或行动，不能只重复句式"},
    {"id": "preserve-strength", "setup": "庞大海把逃跑解释成保存有生力量", "rule": "后续必须出现他反向留下承担风险的变化"},
    {"id": "clause-number", "setup": "严九尺用条目编号压人", "rule": "后续可由同一规章反向限制他，但不能靠巧嘴直接翻盘"}
  ],
  "fatigued_mechanisms": [],
  "serious_scene_limits": [
    "出现实际伤势、坏死灵苗或逐出裁定时，笑点密度降为低",
    "公开核验中笑点只能来自程序和人物反应，不能破坏证据可信度",
    "受挫章节结尾不得用段子抹平损失",
    "每个笑点必须至少改变行动、信息、关系或资源中的一项"
  ]
}
